{
  "schema_version": "evidence_index_v1",
  "run_id": "qrspi_final",
  "frozen": true,
  "freeze_id": "freeze_0001",
  "generated_at": "2026-05-10T04:33:46.134378+00:00",
  "items": [
    {
      "evidence_id": "ev_policy_decision_policy_decision_json",
      "kind": "POLICY_DECISION",
      "path": "policy_decision.json",
      "sha256": "387b03814dd4d2b3056154b58566f873b0b2e6d22e14145855c9a1aec4961a10",
      "producer": "policy_engine",
      "producer_command_id": "cmd_policy_decision",
      "trust_level": "L4_AUTHORITY",
      "created_before_freeze": true
    }
  ]
}
