{
  "schema_version": "evidence_index_v1",
  "run_id": "build_pipeline",
  "frozen": true,
  "freeze_id": "freeze_0001",
  "generated_at": "2026-05-10T09:52:09.678341+00:00",
  "items": [
    {
      "evidence_id": "ev_trace_trace_jsonl",
      "kind": "TRACE",
      "path": "trace.jsonl",
      "sha256": "955ef8df33eb3cb3131efe809adb1ea80aa632f8a25672d03df8a620c6d9e362",
      "producer": "guarded_worker",
      "producer_command_id": "cmd_trace",
      "trust_level": "L2_EXECUTION_EVIDENCE",
      "created_before_freeze": true
    },
    {
      "evidence_id": "ev_step_log_step_logs_1_json",
      "kind": "STEP_LOG",
      "path": "step_logs/1.json",
      "sha256": "e87cb111dc5632e67de811954e38c1102affce9ea576e63c26fcb398a79a3357",
      "producer": "guarded_worker",
      "producer_command_id": "cmd_step_log",
      "trust_level": "L2_EXECUTION_EVIDENCE",
      "created_before_freeze": true
    },
    {
      "evidence_id": "ev_verifier_artifact_verifier_artifacts_V_BUILD_PIPELINE_json",
      "kind": "VERIFIER_ARTIFACT",
      "path": "verifier_artifacts/V.BUILD_PIPELINE.json",
      "sha256": "f0ac21d649da410a9e47c54a6b58627e93a8ebb92e02524b884276658f0dd27f",
      "producer": "verifier_provenance",
      "producer_command_id": "cmd_verifier_artifact",
      "trust_level": "L3_VERIFIER_EVIDENCE",
      "created_before_freeze": true,
      "artifact_id": "V.BUILD_PIPELINE",
      "cited_by_policy": false
    },
    {
      "evidence_id": "ev_verifier_smell_report_verifier_smell_reports_V_BUILD_PIPELINE_json",
      "kind": "VERIFIER_SMELL_REPORT",
      "path": "verifier_smell_reports/V.BUILD_PIPELINE.json",
      "sha256": "1a04624f248538e7e38c492e08271fe46b0b2b8cb8ea44070d906e3730f60c7e",
      "producer": "smell_scanner",
      "producer_command_id": "cmd_smell_scan",
      "trust_level": "L3_VERIFIER_QUALITY",
      "created_before_freeze": true
    },
    {
      "evidence_id": "ev_verifier_strength_report_verifier_strength_reports_V_BUILD_PIPELINE_json",
      "kind": "VERIFIER_STRENGTH_REPORT",
      "path": "verifier_strength_reports/V.BUILD_PIPELINE.json",
      "sha256": "beee1d52e2c02169925bc3695b5d578d7788e364ad2a23d718f84f6c2a203dc8",
      "producer": "strength_scorer",
      "producer_command_id": "cmd_strength_score",
      "trust_level": "L3_VERIFIER_QUALITY",
      "created_before_freeze": true
    },
    {
      "evidence_id": "ev_policy_decision_policy_decision_json",
      "kind": "POLICY_DECISION",
      "path": "policy_decision.json",
      "sha256": "fe90c328c62cba8549979ba0bd4508ff76f6bd3100346e9d55cca675216c4212",
      "producer": "policy_engine",
      "producer_command_id": "cmd_policy_decision",
      "trust_level": "L4_AUTHORITY",
      "created_before_freeze": true
    },
    {
      "evidence_id": "ev_certification_certification_json",
      "kind": "CERTIFICATION",
      "path": "certification.json",
      "sha256": "c1ade57a36a2ed31210070bf6caa70b39bf2bcfba663f4f71ef95427bcfe937a",
      "producer": "certify_run",
      "producer_command_id": "cmd_certification",
      "trust_level": "L4_AUTHORITY",
      "created_before_freeze": true
    },
    {
      "evidence_id": "ev_final_status_final_status_json",
      "kind": "FINAL_STATUS",
      "path": "final_status.json",
      "sha256": "a39d7538bde6221cbc12f566afd007caa847c3ae54c465cea9463406b302be07",
      "producer": "certify_run",
      "producer_command_id": "cmd_final_status",
      "trust_level": "L4_AUTHORITY",
      "created_before_freeze": true
    }
  ]
}
