{
  "schema_version": "evidence_index_v1",
  "run_id": "iter_test",
  "frozen": true,
  "freeze_id": "freeze_0001",
  "generated_at": "2026-05-10T08:11:20.793802+00:00",
  "items": [
    {
      "evidence_id": "ev_trace_trace_jsonl",
      "kind": "TRACE",
      "path": "trace.jsonl",
      "sha256": "6b3871d61e3158dd9422ea93eb298b7059eca52fc824e4fd2122f704db8686c6",
      "producer": "guarded_worker",
      "producer_command_id": "cmd_trace",
      "trust_level": "L2_EXECUTION_EVIDENCE",
      "created_before_freeze": true
    },
    {
      "evidence_id": "ev_step_log_step_logs_1_json",
      "kind": "STEP_LOG",
      "path": "step_logs/1.json",
      "sha256": "7a05b86902d0c5ec4f1e22a8b987d94444bc0e7d13e285c6ee36eff892a2c5c7",
      "producer": "guarded_worker",
      "producer_command_id": "cmd_step_log",
      "trust_level": "L2_EXECUTION_EVIDENCE",
      "created_before_freeze": true
    },
    {
      "evidence_id": "ev_verifier_artifact_verifier_artifacts_V_ITER_TEST_json",
      "kind": "VERIFIER_ARTIFACT",
      "path": "verifier_artifacts/V.ITER_TEST.json",
      "sha256": "e2a429338757fdb7358f32005de7553f111ae71181125a80c728e41a2ed1fd98",
      "producer": "verifier_provenance",
      "producer_command_id": "cmd_verifier_artifact",
      "trust_level": "L3_VERIFIER_EVIDENCE",
      "created_before_freeze": true,
      "artifact_id": "V.ITER_TEST",
      "cited_by_policy": true
    },
    {
      "evidence_id": "ev_verifier_smell_report_verifier_smell_reports_V_ITER_TEST_json",
      "kind": "VERIFIER_SMELL_REPORT",
      "path": "verifier_smell_reports/V.ITER_TEST.json",
      "sha256": "be197f36643efd38025df210808460ba36dbb813468383698b3ff1cfce29effd",
      "producer": "smell_scanner",
      "producer_command_id": "cmd_smell_scan",
      "trust_level": "L3_VERIFIER_QUALITY",
      "created_before_freeze": true
    },
    {
      "evidence_id": "ev_verifier_strength_report_verifier_strength_reports_V_ITER_TEST_json",
      "kind": "VERIFIER_STRENGTH_REPORT",
      "path": "verifier_strength_reports/V.ITER_TEST.json",
      "sha256": "bbe8f588425efdc7f84211faeb7f72413a5867ee237233f621059adfcb849d1e",
      "producer": "strength_scorer",
      "producer_command_id": "cmd_strength_score",
      "trust_level": "L3_VERIFIER_QUALITY",
      "created_before_freeze": true
    },
    {
      "evidence_id": "ev_policy_decision_policy_decision_json",
      "kind": "POLICY_DECISION",
      "path": "policy_decision.json",
      "sha256": "3cea2cbd2bbd79e7d6b5c45582468863ed3ed13a33e0584bbe8dd8be5c46a323",
      "producer": "policy_engine",
      "producer_command_id": "cmd_policy_decision",
      "trust_level": "L4_AUTHORITY",
      "created_before_freeze": true
    },
    {
      "evidence_id": "ev_certification_certification_json",
      "kind": "CERTIFICATION",
      "path": "certification.json",
      "sha256": "245be7b02dff691cdc51cf961adc8cd0bb6e1fe0b9c572fe097dc0901eb876ad",
      "producer": "certify_run",
      "producer_command_id": "cmd_certification",
      "trust_level": "L4_AUTHORITY",
      "created_before_freeze": true
    },
    {
      "evidence_id": "ev_final_status_final_status_json",
      "kind": "FINAL_STATUS",
      "path": "final_status.json",
      "sha256": "9de2f45f74bd08ffddedf30977a3fd02faf2318f070bfa1d410502454daf212a",
      "producer": "certify_run",
      "producer_command_id": "cmd_final_status",
      "trust_level": "L4_AUTHORITY",
      "created_before_freeze": true
    }
  ]
}
